### ISSUE TITLE
Issues with ssh disconnects when connecting to ESI nodes

### ISSUE THREAD

**Issue by tzumainn** [CCI-MOC/ops-issues#886]
There appears to be an intermittent issue with disconnects when ssh'ing to ESI nodes, with disconnects happening after anywhere from 2 to 20 minutes. Some random data points:

* The issue seems to be sometimes worse if connecting through a floating IP versus connecting through the fixed IP; at one point I connected to a node through both at the same time and the former disconnected while the latter lasted for over a day. At other times they simultaneously disconnected.
* On the UKL node I played with various *AliveInterval/*AliveCountMax configurations on the server and client side. Neither seemed to have an effect.
* Derek reports that the issue sometimes goes away; for example, as of now he says it's not a problem. He also reported a node where it happened the "most", which is listed below.
* I installed mosh (https://mosh.org/) on the UKL node and it does indeed allow a connection to persist, with no problems that I can see.

The two specific nodes that the issue has been reported upon are:

* oct4-08, on the ukl private network (192.168.51.40) with public IP 128.31.20.70
* oct4-cha3-3b, on the okd private network (192.168.53.84) with public IP 128.31.20.39

**Comment by derekhiggins** [comment]
Seeing lots off ssh connections getting dropped today from 128.31.20.39 and other floating IP's again today ( 128.31.20.39 is only special as its the host I've been using most). Its leaving the server pretty much unusable to do anything interactivity. ping to the floating ip is also showing problems.

Fixed IP's seem to be either unaffected or more reliable by an order of magnitude.

**Comment by joachimweyl** [comment]
@hakasapl can you check on possible network issues that could be causing this.

**Comment by derekhiggins** [comment]
> Thanks for the report! Out of curiosity, how are you testing the fixed IP connectivity?
I had a tmux session opened from one host on the network 2 another over the fixed ip, 
the floating ip connection dropped but the ssh connection in tmux to a fixed ip was still up

**Comment by tzumainn** [comment]
Okay, thanks! Would using something like mosh for now be possible while we debug the issue?

**Comment by derekhiggins** [comment]
> Okay, thanks! Would using something like mosh for now be possible while we debug the issue?

thanks, I've give it a go,

**Comment by tzumainn** [comment]
I don't know if this is relevant, but after some further testing I've discovered that the floating IP doesn't respond to pings above a certain size:

```
[root@overcloud-controller-1 log]# ping 128.31.20.70 -s1472
PING 128.31.20.70 (128.31.20.70) 1472(1500) bytes of data.
1480 bytes from 128.31.20.70: icmp_seq=1 ttl=52 time=5.15 ms
1480 bytes from 128.31.20.70: icmp_seq=2 ttl=52 time=5.09 ms
^X^C
--- 128.31.20.70 ping statistics ---
2 packets transmitted, 2 received, 0% packet loss, time 1001ms
rtt min/avg/max/mdev = 5.088/5.120/5.153/0.078 ms
[root@overcloud-controller-1 log]# ping 128.31.20.70 -s1473
PING 128.31.20.70 (128.31.20.70) 1473(1501) bytes of data.
^X^C
--- 128.31.20.70 ping statistics ---
6 packets transmitted, 0 received, 100% packet loss, time 5136ms
```

If you use the fixed IP, then pings of greater sizes work. I'll try and figure out what this means tomorrow.

**Comment by tzumainn** [comment]
Okay, so the MTU research may have been a distraction. One new thing I've discovered is this - let's say I have a node connected to a private internal network through an external floating IP. An OpenStack router connecting the private network with the external network exists. Now, if I run `tcpdump` on that router on all three controllers looking for action on the ssh port:

`ip netns exec qrouter-492294fb-3714-44d1-85c6-f5b56e8efaa0 tcpdump tcp port 22`

And then ssh to the node, I'll get a mess of action on a single controller, while the tcpdump on the other two will show nothing. If I then run a repeated script on the node, like `while true ; do date && sleep 5; done`, then every 5 seconds that single controller will have an ssh communication - for example:

```
13:36:05.200771 IP 192.168.50.179.ssh > c-24-91-128-177.hsd1.ma.comcast.net.56592: Flags [P.], seq 18546:18614, ack 3358, win 501, options [nop,nop,TS val 3845562151 ecr 2415696349], length 68
13:36:05.295838 IP c-24-91-128-177.hsd1.ma.comcast.net.56592 > 192.168.50.179.ssh: Flags [.], ack 18614, win 351, options [nop,nop,TS val 2415701354 ecr 3845562151], length 0
13:36:10.205198 IP 192.168.50.179.ssh > c-24-91-128-177.hsd1.ma.comcast.net.56592: Flags [P.], seq 18614:18682, ack 3358, win 501, options [nop,nop,TS val 3845567155 ecr 2415701354], length 68
13:36:10.331901 IP c-24-91-128-177.hsd1.ma.comcast.net.56592 > 192.168.50.179.ssh: Flags [.], ack 18682, win 351, options [nop,nop,TS val 2415706391 ecr 3845567155], length 0
```

Now, at some point my ssh session will no longer respond. Simultaneously, I'll no longer see any ssh action through the original controller's tcpdump; instead I'll suddenly see it on a *different* controller.

I'm not sure whether this controller movement is a symptom or a cause, but it clearly seems related to these disconnects.

**Comment by tzumainn** [comment]
Awesome! I'm going to leave this open while I try and figure out if there's a configuration that makes HA work.

**Comment by tzumainn** [comment]
Well, I haven't been able to figure out how to make HA neutron routers work properly, but it seems like the current solution of using non-HA routers is working fine. I've updated the neutron controllers to create non-HA routers by default (this can be overridden on the command line).
