### ISSUE TITLE
Routing public traffic with metallb

### ISSUE THREAD

**Issue by larsks** [CCI-MOC/ops-issues#1376]
The moc-infra cluster was installed on an internal network. We have added a public network to each node and we would like to be able to use metallb to assign public addresses to specific services. While metallb has been installed and appears to be configured correctly, we are not able to reach the public addresses assigned to services from anywhere other than the node on which the service is hosted.

**Comment by larsks** [comment]
## Example

The following manifests create a Deployment and a corresponding Service that we used to debug this issue:

```
apiVersion: v1
kind: Service
metadata:
  labels:
    app: whoami
  name: whoami
spec:
  ports:
  - name: http
    port: 5432
    targetPort: http
  selector:
    app: whoami
  type: LoadBalancer
---
apiVersion: apps/v1
kind: Deployment
metadata:
  labels:
    app: whoami
  name: whoami
spec:
  replicas: 1
  selector:
    matchLabels:
      app: whoami
  template:
    metadata:
      labels:
        app: whoami
    spec:
      containers:
      - env:
        - name: WHOAMI_PORT_NUMBER
          value: "8080"
        image: docker.io/traefik/whoami
        name: whoami
        ports:
        - containerPort: 8080
          name: http
```

After deploying these manifests on the moc-infra cluster, we ended up with:

```
$ kubectl get service
NAME              TYPE           CLUSTER-IP      EXTERNAL-IP   PORT(S)          AGE
whoami            LoadBalancer   172.30.203.62   129.10.5.11   5432:31909/TCP   148m
```

## The problem

Traffic to our public ip address (`129.10.5.11`) was arriving at the node...

```
[root@moc-infra-1 /]# tcpdump -i any -nn host 129.10.5.11 or host 172.30.203.62
17:41:22.084853 ens3f0np0 In  IP 128.197.28.40.56886 > 129.10.5.11.5432: Flags [S], seq 203253177, win 64240, options [mss 1460,sackOK,TS val 1041374623 ecr 0,nop,wscale 7], length 0
17:41:23.111827 ens3f0np0 In  IP 128.197.28.40.56886 > 129.10.5.11.5432: Flags [S], seq 203253177, win 64240, options [mss 1460,sackOK,TS val 1041375651 ecr 0,nop,wscale 7], length 0
17:41:24.136055 ens3f0np0 In  IP 128.197.28.40.56886 > 129.10.5.11.5432: Flags [S], seq 203253177, win 64240, options [mss 1460,sackOK,TS val 1041376675 ecr 0,nop,wscale 7], length 0
.
.
.
```

...but we weren't seeing any reply.

### IP forwarding is disabled by default

Modern OpenShift ships with the [`ip_forward` sysctl](https://sysctl-explorer.net/net/ipv4/ip_forward/) disabled in the global namespace. We need to enable this:

```
sysctl net.ipv4.ip_forward=1
```

### The kernel reverse path filter

Packets are getting rejected by the kernel's reverse path filter, controlled by the global and per-interface [`rp_filter` sysctl](https://sysctl-explorer.net/net/ipv4/rp_filter/). This setting controls what the kernel does with traffic that would result in asymmetric routing (traffic for which the reply goes out an interface other than the one on which the request entered the system).  There are three possible values for the `rp_filter` setting:

- 0 - Disabled. The kernel performs no source validation.
- 1 - Strict. The kernel will drop packets if a response would go out an interface other than the one on which the packet entered.
- 2 - Loose. The kernel will drop packets if the origin address is unreachable (that is, there is no route back to the origin).

On the system as initially configured, we see the public interface was configured with strict reverse path filtering:

```
[root@moc-infra-1 /]# sysctl net.ipv4.conf.ens3f0np0.rp_filter
net.ipv4.conf.ens3f0np0.rp_filter = 1
```

We can change this to loose mode (`2`) like this:

```
[root@moc-infra-1 /]# sysctl net.ipv4.conf.ens3f0np0.rp_filter=2
net.ipv4.conf.ens3f0np0.rp_filter = 2
```

With this change, the kernel will no longer drop incoming traffic because there is *a* route to the destination (via the system's default gateway). Repeating the earlier `tcpdump`, we see:

```
17:48:40.649218 ens3f0np0 In  IP 128.197.28.40.9392 > 129.10.5.11.5432: Flags [S], seq 2819228115, win 64240, options [mss 1460,sackOK,TS val 1041813188 ecr 0,nop,wscale 7], length 0
17:48:40.649261 br-ex Out IP 128.197.28.40.9392 > 172.30.203.62.5432: Flags [S], seq 2819228115, win 64240, options [mss 1460,sackOK,TS val 1041813188 ecr 0,nop,wscale 7], length 0
17:48:40.654451 br-ex In  IP 172.30.203.62.5432 > 128.197.28.40.9392: Flags [S.], seq 2531575518, ack 2819228116, win 64704, options [mss 1360,sackOK,TS val 3416886674 ecr 1041813188,nop,wscale 7], length 0
17:48:40.654480 br-ex Out IP 129.10.5.11.5432 > 128.197.28.40.9392: Flags [S.], seq 2531575518, ack 2819228116, win 64704, options [mss 1360,sackOK,TS val 3416886674 ecr 1041813188,nop,wscale 7], length 0
17:48:40.655024 ens2f0np0 Out IP 129.10.5.11.5432 > 128.197.28.40.9392: Flags [S.], seq 2531575518, ack 2819228116, win 64704, options [mss 1360,sackOK,TS val 3416886674 ecr 1041813188,nop,wscale 7], length 0
```

So our request is making more progress, but the reply is going out the wrong interface (`ens2f0np0` instead of `ens3f0np0`).

### Incorrect routing

The `main` routing table on these hosts looks like this:

```
[root@moc-infra-1 /]# ip route
default via 172.16.0.1 dev br-ex proto dhcp src 172.16.0.238 metric 48
10.128.0.0/23 dev ovn-k8s-mp0 proto kernel scope link src 10.128.0.2
10.128.0.0/14 via 10.128.0.1 dev ovn-k8s-mp0
129.10.5.0/24 dev ens3f0np0 proto kernel scope link src 129.10.5.51
169.254.169.0/29 dev br-ex proto kernel scope link src 169.254.169.2
169.254.169.1 dev br-ex src 172.16.0.238
169.254.169.3 via 10.128.0.1 dev ovn-k8s-mp0
172.16.0.0/19 dev br-ex proto kernel scope link src 172.16.0.238 metric 48
172.30.0.0/16 via 169.254.169.4 dev br-ex mtu 1400
```

The reply from our web service is directed to `128.197.28.40`. According to the above routing table, this should be handled by the default gateway, `172.16.0.1`, which is associated with OVS bridge `br-ex`, which is ultimately connected to interface `ens2f0np0`:

```
    Bridge br-ex
        Port patch-br-ex_moc-infra-1-to-br-int
            Interface patch-br-ex_moc-infra-1-to-br-int
                type: patch
                options: {peer=patch-br-int-to-br-ex_moc-infra-1}
        Port br-ex
            Interface br-ex
                type: internal
        Port ens2f0np0
            Interface ens2f0np0
                type: system
```

The `172.16.0.1` router doesn't know what to do with our reply packet (because it has a source address of `129.10.5.11`), so it gets dropped at the gateway.

To resolve this, we need to arrange for replies to requests coming in on the public interface to go back *out* the public interface. We need to create route policy rules to handle this...and before we can *that*, we need to assign an ip address to the public interface on the host:

```
ip addr add 129.10.5.51/24 dev ens3f0np0
ip link set ens3f0np0 up
```

The routing solution is slightly complicated by the fact that the public address is connected to our service via NAT rule:

```
-A OVN-KUBE-EXTERNALIP -d 129.10.5.11/32 -p tcp -m tcp --dport 5432 -j DNAT --to-destination 172.30.203.62:5432
```

This means that the response, at the time the kernel makes the routing decision, is the internal service ip, `172.30.203.62`...which means we can't simply match the source address of the response, like this:

```
ip rule add from 129.10.5.0/24 table 127
```

Instead, we need to:

1. Mark the inbound connection so that we can identify replies
2. Use that mark to implement our routing logic

We can add the connection mark by adding these netfilter rules:

```
iptables -t mangle -A PREROUTING -j CONNMARK --restore-mark
iptables -t mangle -A PREROUTING -m mark ! --mark 0x0 -j RETURN
iptables -t mangle -A PREROUTING -i ens3f0np0 -j MARK --set-xmark 0x127
iptables -t mangle -A POSTROUTING -j CONNMARK --save-mark
```

Incoming packets on interface `ens3f0np0` have there mark to set `0x127` (a value we chose just because it corresponds to the public vlan id). The subsequent `--save-mark` rule copies the packet mark to the connection mark. The `--restore-mark` rule performs the reverse: if a packet is part of an existing connection and a connection mark exists, the mark is copied to the packet mark.

We can use the packet mark in routing policy rules, like this:

```
ip rule add prio 10127 fwmark 0x127 lookup 127
```

This means, "if a packet has mark `0x127`, use routing table `127` instead of the main routing table". We would then populate routing table 127 with an appropriate default gateway:

```
ip route add default via 129.10.5.1 table 127
```

By itself, this introduces a problem: the firewall mark is applied to incoming packets, which would match the above rule, which would cause all incoming traffic on the public interface to get mis-routed. We need to add a higher priority rule ("higher priority" means "lower number") that will apply the `main` routing table, except for the default gateway, to inbound packets:

```
ip rule add prio 10000 lookup main suppress_prefixlength 0
```

This gives us:

```
sh-5.1# ip rule list
0:      from all lookup local
30:     from all fwmark 0x1745ec lookup 7
10000:  from all lookup main suppress_prefixlength 0
10127:  from all fwmark 0x127 lookup 127
32766:  from all lookup main
32767:  from all lookup default
```

And:

```
sh-5.1# ip route show table 127
default via 129.10.5.1 dev ens3f0np0
```

And now replies are exiting on the correct interface:

```
[root@moc-infra-1 /]# tcpdump -i any -nn host 129.10.5.11 or host 172.30.203.62
18:12:03.607593 ens3f0np0 In  IP 128.197.28.40.37283 > 129.10.5.11.5432: Flags [S], seq 4074433436, win 64240, options [mss 1460,sackOK,TS val 1043216147 ecr 0,nop,wscale 7], length 0
18:12:03.607637 br-ex Out IP 128.197.28.40.37283 > 172.30.203.62.5432: Flags [S], seq 4074433436, win 64240, options [mss 1460,sackOK,TS val 1043216147 ecr 0,nop,wscale 7], length 0
18:12:03.615271 br-ex In  IP 172.30.203.62.5432 > 128.197.28.40.37283: Flags [S.], seq 147304233, ack 4074433437, win 64704, options [mss 1360,sackOK,TS val 3418289635 ecr 1043216147,nop,wscale 7], length 0
18:12:03.615306 ens3f0np0 Out IP 129.10.5.11.5432 > 128.197.28.40.37283: Flags [S.], seq 147304233, ack 4074433437, win 64704, options [mss 1360,sackOK,TS val 3418289635 ecr 1043216147,nop,wscale 7], length 0
```

And we can successfully reach our web service from outside the cluster:

```
$ curl 129.10.5.11:5432
Hostname: whoami-969b8786-pq7d6
IP: 127.0.0.1
IP: ::1
IP: 10.130.1.244
IP: fe80::858:aff:fe82:1f4
RemoteAddr: 100.64.0.2:37283
GET / HTTP/1.1
Host: 129.10.5.11:5432
User-Agent: curl/8.6.0
Accept: */*
```

**Comment by larsks** [comment]
@naved001 notes that there is now official documentation for [another way of resolving this issue](https://docs.openshift.com/container-platform/4.14/networking/metallb/metallb-configure-return-traffic.html#nw-metallb-configure-return-traffic-proc_metallb-configure-return-traffic), but it may require that we use metallb in bgp mode.
