### ISSUE TITLE
Connect Smaug cluster to NESE Ceph storage

### ISSUE THREAD

**Issue by larsks** [CCI-MOC/ops-issues#390]
We need to connect the operate-first Smaug cluster to NESE Ceph
storage.

This depends on #378 (which is waiting on us to figure out ip
address allocation).

**Comment by larsks** [comment]
Original email to the NESE folks:

```
I spent some time investigating what's actually required to get
OpenShift connected to an external Ceph cluster [1], and based on that
work I'd like to make the following request:

1. Create for us a 20TB RBD pool.
2. Create the following principals and associated capabilities:

      ceph auth add client.healthchecker-moc-ocp-prod \
              mgr "allow command config" \
              mon "allow r, allow command quorum_status, allow command version"

      ceph auth add client.csi-rbd-provisioner-moc-ocp-prod \
              mgr "allow rw" \
              mon "profile rbd" \
              osd "profile rbd pool=${poolname}"

      ceph auth add client.csi-rbd-node-moc-ocp-prod \
              mon "profile rbd" \
              osd "profile rbd pool=${poolname}"

  I've used the suffix `-moc-ocp-prod` here (because that's the
  cluster name), but if you have your own standard naming scheme feel
  free to use that instead. I've also left the pool name as
  `${poolname}` because I don't know how you name things.

Cheers,

[1]: https://blog.oddbit.com/post/2021-08-23-external-ocs/
```

**Comment by larsks** [comment]
@naved001 and I hung out with Milan during office hours today while getting things configured. Milan has created an RBD pool for us and a single Ceph principal to use for testing. We initially encountered a network problem; something in the path between our test machine and the Ceph servers was clamping the MTU to 1500 bytes.

@hakasapl was able to identify and correct the problematic configuration.

We now have a large-MTU clean path between our clients and the Ceph server, but we haven't been able to successfully interact with the ceph cluster.

**Comment by larsks** [comment]
Email to NESE folks today:

```
Milan,

Thanks for your help today. Working with Hakan we were able to
identify the switch that was dropping large frames. We are now able to
successfully `ping -s 9000` the Ceph servers:

  [root@client1 ~]# ping -s 9000 -c 2 10.255.116.11
  PING 10.255.116.11 (10.255.116.11) 9000(9028) bytes of data.
  9008 bytes from 10.255.116.11: icmp_seq=1 ttl=62 time=0.980 ms
  9008 bytes from 10.255.116.11: icmp_seq=2 ttl=62 time=0.402 ms

  --- 10.255.116.11 ping statistics ---
  2 packets transmitted, 2 received, 0% packet loss, time 1001ms
  rtt min/avg/max/mdev = 0.402/0.691/0.980/0.289 ms

(This also works with .12, .13, and .14)

Unfortunately, we're still not able to successfully run the `ceph
status` command. If I run...

  [root@client1 ~]# ceph  --user provisioner-moc-rbd-1 status
 
...the command just hands.

It looks as if the remote (10.255.116.nn) is refusing the connection;
running tcpdump during the connection attempt shows:

  20:48:22.488393 IP 10.0.123.253.34538 > 10.255.116.12.3300: Flags [S], seq 911887672, win 26880, options [mss 8960,sackOK,TS val 1169564924 ecr 0,nop,wscale 7], length 0
  20:48:22.488637 IP 10.255.116.12.3300 > 10.0.123.253.34538: Flags [R.], seq 0, ack 911887673, win 0, length 0
  20:48:22.488702 IP 10.0.123.253.33910 > 10.255.116.14.3300: Flags [S], seq 1449475497, win 26880, options [mss 8960,sackOK,TS val 3861989349 ecr 0,nop,wscale 7], length 0
  20:48:22.488886 IP 10.255.116.14.3300 > 10.0.123.253.33910: Flags [R.], seq 0, ack 1449475498, win 0, length 0

And in fact, we can confirm that with nc:

  [root@client1 ~]# nc 10.255.116.11 3300
  Ncat: Connection refused.

It looks like there may be a configuration issue on the ceph servers
that is blocking the connection.

```

**Comment by larsks** [comment]
Milan replies:

```
Hi Lars,

That is firewall running on the cluster. I'll open the ports on the 
firewall for your network the first thing in the morning.

Milan
```

**Comment by larsks** [comment]
It looks as if we're successfully able to communicate with the
cluster:

    $ ceph  --user provisioner-moc-rbd-1 status
    cluster:
      id:     6de96983-eef7-4690-9a6d-9124d3707a30
      health: HEALTH_WARN
              Low space hindering backfill (add storage if this doesn't resolve itself): 2 pgs backfill_toofull
              Degraded data redundancy: 3902012/19357513240 objects degraded (0.020%), 30 pgs degraded, 30 pgs undersized
              1 pgs not deep-scrubbed in time
              1 pgs not scrubbed in time
    [...]

I can successfully create and use an RBD device.

I've asked Milan to go ahead and create the additional principals we
need.

**Comment by larsks** [comment]
We have a set of credentials from Milan. I've stored them in Bitwarden; look for:

- smaug nese client.provisioner-moc-rbd-1
- smaug nese client.node-moc-rbd-1
- smaug nese client.healthchecker-moc-rbd-1

**Comment by larsks** [comment]
It looks like even with a proper set of credentials that OCS is unhappy. It may require access to the Ceph prometheus endpoint. I've reached out to hugh and heidi to see if they can connect me with someone who knows OCS internals.

**Comment by screeley44** [comment]
comments from JC Lopez
```
Hi,

per the documentation the exporter script has to be run from a node that can access the external cluster that you want to get access to. This node can be a Monitor node or an admin node for that cluster.

The exporter script will create the correct cephx credentials required to access the cluster so you can create RBD images and CephFS “shares”. The exporter script can be download from the OCP OCS install wizard dialog. It is a python script.

If the OCP team does not manage the external cluster you have to get in touch with the team that manages the cluster so they can run the script for you. No other solution.

The exporter script as an option to specify the monitoring endpoint if it can not be retrieved automatically by the script.

```

It is all documented [here](https://access.redhat.com/documentation/en-us/red_hat_openshift_container_storage/4.8/html/deploying_openshift_container_storage_in_external_mode/creating-an-openshift-container-storage-cluster-service-for-external-storage_rhocs)

**Comment by larsks** [comment]
> per the documentation the exporter script has to be run from a node that can access the external cluster that you want to get access to. This node can be a Monitor node or an admin node for that cluster.

@screeley44 I think you've missed the fundamental question I'm trying to ask. I'll follow up via email.

**Comment by leseb** [comment]
> @leseb:
> 
> > Can we clarify this point? Did anyone run the external script to create resources?
> 
> No, we don't have access (except via ceph protocols) to the remote cluster, and the cluster admins aren't willing to run a script that's going to make changes to their cluster. I ended up manually generating the JSON, ending up with this (redacted):
> 
> ```
> [
>   {
>     "name": "rook-ceph-mon-endpoints",
>     "kind": "ConfigMap",
>     "data": {
>       "data": "ceph0=...:6789",
>       "maxMonId": "0",
>       "mapping": "{}"
>     }
>   },
>   {
>     "name": "rook-ceph-mon",
>     "kind": "Secret",
>     "data": {
>       "fsid": "...",
>       "admin-secret": "admin-secret",
>       "mon-secret": "mon-secret"
>     }
>   },
>   {
>     "name": "rook-ceph-operator-creds",
>     "kind": "Secret",
>     "data": {
>       "userID": "client.healthchecker-moc-rbd-1",
>       "userKey": "..."
>     }
>   },
>   {
>     "name": "ceph-rbd",
>     "kind": "StorageClass",
>     "data": {
>       "pool": "moc_rbd_1"
>     }
>   },
>   {
>     "name": "rook-csi-rbd-node",
>     "kind": "Secret",
>     "data": {
>       "userID": "node-moc-rbd-1",
>       "userKey": "..."
>     }
>   },
>   {
>     "name": "rook-csi-rbd-provisioner",
>     "kind": "Secret",
>     "data": {
>       "userID": "provisioner-moc-rbd-1",
>       "userKey": "..."
>     }
>   }
> ]
> ```
> 
> I'm reasonable certain that matches what the discovery script will produce when cephfs and rgw are not enabled (minus the monitoring endpoint, because we don't have access to that).

Why don't we have access to the Prometheus metrics? Is it a design choice for the deployment?

> 
> > Where is OCS "unhappy"?
> 
> On a test environment, I was never able to get the OCS installation to complete, but deploying it just now on our production cluster -- much to my complete surprise -- it seems to have Just Worked. That means our outstanding questions are really going to be around the discovery script, and whether it's possible to (a) document specifically what cephx principals and permissions are necessary, and (b) create a read-only version of the discovery script that will generate the appropriate JSON without making changes to the cluster (and (c) provide an alternative means of generating the JSON if running a script on the remote cluster isn't possible even with a read-only version available).

I think most of that has been registered already in BZ that we are planning on taking care of in the next ODF 4.10 cycle. Glad to see it's working somehow after a second attempt.

**Comment by larsks** [comment]
This achieved "mostly working" status so I'm going to close this issue and track the current difficulties in a new one.
